{
  "$schema": "https://json-schema.org/draft/2020-12/schema",
  "title": "HUD Data",
  "description": "Data about a HUD",
  "type": "object",
  "required": [
    "name",
    "author",
    "repo",
    "channels",
    "resources"
  ],
  "properties": {
    "name": {
      "title": "HUD Name",
      "description": "Display name of your HUD",
      "type": "string",
      "examples": [
        "My HUD"
      ]
    },
    "author": {
      "description": "Display name of you, the active developer of the HUD (however, outdated HUD maintenance may not count as authoring in some cases)",
      "type": "string",
      "examples": [
        "Cool person"
      ]
    },
    "contributors": {
      "description": "Display names of anyone you would like to credit for the creation/development of the HUD. Not to be used for general credits, but major and direct contributors",
      "type": "array",
      "items": {
        "type": "string"
      },
      "examples": [
        "Original creator, Previous maintainer"
      ]
    },
    "releaseDate": {
      "description": "Initial release date of the HUD, YYYY-MM-DD",
      "type": "string",
      "format": "date",
      "examples": [
        "2009-12-31"
      ]
    },
    "parent": {
      "description": "If this HUD is a slight edit of another, put its ID here. This will group the HUDs together.",
      "type": "string",
      "pattern": "^[\\w][\\w.-]*$",
      "examples": [
        "their-hud"
      ]
    },
    "distinguishedFromParent": {
      "description": "If this HUD is a major update/edit to its parent, and thus should be listed separately from the parent HUD.",
      "type": "boolean"
    },
    "resources": {
      "description": "A list of image names/YouTube videos. Images are automatically converted to webp, do not use extensions for uploaded images. First resource is required, must be an image and is used as the display banner. Resources also support youtu.be links for video embeds.",
      "type": "array",
      "items": {
        "type": "string",
        "pattern": "^([\\w][\\w.-]*|https://youtu.be/[\\w-]+)$"
      },
      "minItems": 1,
      "maxItems": 15,
      "uniqueItems": true,
      "examples": [
        "myhud-banner, cool-image-1, https://youtu.be/21asadf"
      ]
    },
    "social": {
      "title": "External Links",
      "description": "Links to your social media profiles and other pages",
      "type": "object",
      "properties": {
        "support": {
          "description": "A link people can use to support you financially",
          "type": "string",
          "format": "uri",
          "pattern": "^https://",
          "examples": [
            "https://ko-fi.com/super-duper-person"
          ]
        },
        "issues": {
          "description": "An extra link where users can get help/report issues. If not present, will use GitHub Issues.",
          "format": "uri",
          "pattern": "^https://",
          "type": "string"
        },
        "steam_profile": {
          "description": "Your SteamID64",
          "type": "string",
          "pattern": "[^/][0-9]{8,}",
          "examples": [
            "76561191234567890"
          ]
        },
        "steam_group": {
          "description": "Your Steam group vanity ID (used for custom URLs)",
          "type": "string",
          "pattern": "^([\\w-]){2,32}$",
          "examples": [
            "valve"
          ]
        },
        "twitter": {
          "description": "Your Twitter handle",
          "type": "string",
          "pattern": "^(\\w){1,15}$",
          "examples": [
            "CoolPerson12812"
          ]
        },
        "bsky": {
          "description": "Your BSky handle",
          "type": "string",
          "examples": [
            "coolerperson128123.bsky.social"
          ]
        },
        "discord": {
          "description": "Your Discord server invite code, beginning with / (not the full URL), or your Discord in the format username#0",
          "type": "string",
          "pattern": "^((?=.{2,32}$)(?!(?:everyone|here)$)\\.?[a-z0-9_]+(?:\\.[a-z0-9_]+)*\\.?#0|/\\w+)$",
          "examples": [
            "vanity-or-invite"
          ]
        },
        "youtube": {
          "description": "Your YouTube channel (either /channel/id URL, @username or channel name)",
          "type": "string",
          "pattern": "^(channel\\/UC[\\w-]{21}[AQgw]|(c\\/|user\\/)?[\\w@-]+)$",
          "examples": [
            "@TheCoolPerson"
          ]
        },
        "twitch": {
          "description": "Your Twitch channel name",
          "type": "string",
          "pattern": "^[a-zA-Z0-9][\\w]{0,24}$",
          "examples": [
            "CoolPersonStreamer"
          ]
        },
        "album": {
          "description": "Link to some Imgur album or other to provide more images",
          "type": "string",
          "format": "uri",
          "pattern": "^https://",
          "examples": [
            "https://imgur.com/a/fajsf"
          ]
        }
      },
      "additionalProperties": false
    },
    "flags": {
      "title": "Features",
      "description": "A list of flags whose presence indicates the existence of a feature of some kind",
      "type": "array",
      "items": {
        "type": "string",
        "enum": [
          "fonts",
          "menus",
          "scoreboards",
          "crosshairs",
          "minmode",
          "streamer-mode",
          "materials",
          "customization"
        ]
      },
      "uniqueItems": true
    },
    "traits": {
      "description": "Optional structured mapping of values",
      "type": "object",
      "properties": {
        "os": {
          "description": "What operating systems does the HUD support",
          "type": "array",
          "items": {
            "type": "string",
            "enum": [
              "windows",
              "mac",
              "linux"
            ]
          },
          "uniqueItems": true
        },
        "gamemode": {
          "title": "Game Modes",
          "description": "What gamemodes does the HUD customize for",
          "type": "array",
          "items": {
            "type": "string",
            "enum": [
              "tournament",
              "comp",
              "arena",
              "ad",
              "ctf",
              "cp",
              "halloween",
              "koth",
              "mannpower",
              "mvm",
              "pass",
              "pl",
              "plr",
              "pd",
              "rd",
              "sd",
              "tc"
            ]
          },
          "uniqueItems": true
        },
        "res": {
          "title": "Display Resolutions",
          "description": "What aspect ratios does the HUD support",
          "type": "array",
          "items": {
            "type": "string",
            "enum": [
              "4/3",
              "16/9",
              "16/10",
              "21/9",
              "32/9",
              "17/9",
              "1/1",
              "5/4"
            ]
          },
          "uniqueItems": true
        },
        "position": {
          "description": "What position is the ammo/health in the HUD (multiple customization options can be available)",
          "type": "array",
          "items": {
            "type": "string",
            "enum": [
              "center",
              "corners",
              "default"
            ]
          },
          "uniqueItems": true
        },
        "lang": {
          "title": "Languages",
          "description": "What languages does the HUD support (if it has custom language files)",
          "type": "array",
          "items": {
            "type": "string",
            "pattern": "^[a-z]{2}$"
          },
          "uniqueItems": true,
          "examples": [
            "en"
          ]
        }
      },
      "additionalProperties": false
    },
    "tags": {
      "description": "A list of words associated with the HUD for discovery. Be general. First tag is considered primary and used as a category. There is no list of valid tags, but they are subject to review for usefulness/'spamminess'.",
      "type": "array",
      "items": {
        "type": "string",
        "pattern": "^[\\w-]+$"
      },
      "examples": [
        "minimal, monochrome"
      ]
    },
    "repo": {
      "description": "GitHub repo web URL",
      "type": "string",
      "format": "uri",
      "pattern": "^https://",
      "examples": [
        "https://github.com/cool-person/myhud"
      ]
    },
    "channels": {
      "description": "Release channels for this HUD, mapping a channel name (e.g. 'default', 'beta') to its source and data.",
      "type": "object",
      "required": [
        "default"
      ],
      "properties": {
        "default": {
          "$ref": "#/$defs/channelConfig"
        }
      },
      "patternProperties": {
        "^(?!default$)[a-zA-Z0-9-]+$": {
          "$ref": "#/$defs/channelConfig"
        }
      },
      "additionalProperties": false
    },
    "prerelease": {
      "description": "If this is a prerelease/WIP HUD",
      "type": "boolean"
    },
    "verified": {
      "description": "For internal use only to enable some functionality. Do not set this yourself.",
      "type": "boolean"
    },
    "githubAuthor": {
      "description": "GitHub account used for profile information for the HUD.",
      "anyOf": [
        {
          "type": "string",
          "pattern": "^[a-zA-Z\\d](?:[a-zA-Z\\d]|-(?=[a-zA-Z\\d])){0,38}$"
        },
        {
          "type": "null"
        }
      ]
    }
  },
  "additionalProperties": false,
  "dependentRequired": {
    "parent": [
      "distinguishedFromParent"
    ]
  },
  "$defs": {
    "channelConfig": {
      "type": "object",
      "properties": {
        "source": {
          "description": "How this channel determines its latest version. Can be 'release', 'prerelease', 'branch==<name>', 'tag==<pattern>', 'commit' or omitted for external/manual.",
          "type": "string",
          "pattern": "^(release|prerelease|commit|tag==.+|branch==.+)$"
        },
        "data": {
          "description": "Cached data about the current version in this channel.",
          "type": "object",
          "properties": {
            "ref": {
              "description": "The commit hash or version title of the current active version in this channel.",
              "type": "string"
            },
            "title": {
              "description": "Short title of the latest release",
              "type": "string"
            },
            "publishDate": {
              "description": "Date of publishing the current version, YYYY-MM-DD",
              "type": "string",
              "format": "date"
            }
          },
          "required": [
            "ref"
          ],
          "additionalProperties": false
        }
      },
      "required": [
        "data"
      ],
      "additionalProperties": false
    }
  }
}