{
  "name": "Baz HUD",
  "author": "Bazoo",
  "contributors": [
    "Hypnotize"
  ],
  "social": {
    "steam_group": "BazHUD",
    "album": "https://github.com/TF2HUDsArchive/Baz-Hud/blob/screenshots/showcase.md"
  },
  "repo": "https://github.com/TF2HUDsArchive/Baz-Hud",
  "githubAuthor": null,
  "resources": [
    "baz-hud-banner"
  ],
  "channels": {
    "default": {
      "data": {
        "ref": "4e5251d92d733cc1d3414dffcc075cf4216bb42c"
      }
    }
  }
}
