{
  "name": "Yahud CX",
  "author": "Whayay",
  "contributors": [
    "Hypnotize"
  ],
  "social": {
    "album": "https://github.com/TF2HUDsArchive/Yahud-CX/blob/screenshots/showcase.md"
  },
  "repo": "https://github.com/TF2HUDsArchive/Yahud-CX",
  "githubAuthor": null,
  "parent": "yayahud",
  "resources": [
    "yahud-cx-banner"
  ],
  "channels": {
    "default": {
      "data": {
        "ref": "2ee8ce0da1f9c3f4e2753da8b4a675ed58828de0"
      }
    }
  },
  "distinguishedFromParent": false
}
