{
  "name": "Boats HUD",
  "author": "boat",
  "contributors": [
    "Hypnotize"
  ],
  "social": {
    "album": "https://github.com/TF2HUDsArchive/Boats-Hud/blob/screenshots/showcase.md"
  },
  "repo": "https://github.com/TF2HUDsArchive/Boats-Hud",
  "githubAuthor": null,
  "resources": [
    "boats-hud-banner"
  ],
  "channels": {
    "default": {
      "data": {
        "ref": "92e4c70c86606bbe15d3069989e27d7c958e9e2f"
      }
    }
  }
}
