{
  "name": "Broesel Crsp",
  "author": "extracrispy",
  "contributors": [
    "Hypnotize"
  ],
  "social": {
    "album": "https://github.com/TF2HUDsArchive/Crsp-Broesel/blob/screenshots/showcase.md"
  },
  "repo": "https://github.com/TF2HUDsArchive/Crsp-Broesel",
  "githubAuthor": null,
  "parent": "broesel-hud",
  "resources": [
    "broesel-crsp-banner"
  ],
  "channels": {
    "default": {
      "data": {
        "ref": "5c7dd16d9979bc367241fd02d7c7c8bc9da1e544"
      }
    }
  },
  "distinguishedFromParent": false
}
