{
  "name": "sweetHUD",
  "author": "FireStarW",
  "social": {
    "steam_group": "sweetHud",
    "album": "https://imgur.com/a/aZqCd"
  },
  "repo": "https://github.com/FireStarW/sweetHud",
  "resources": [
    "sweethud-banner"
  ],
  "channels": {
    "default": {
      "data": {
        "ref": "24065b4638ca9422ef1b9419ede7c2ee70da8722"
      }
    }
  }
}
