{
  "name": "sigma wolf hud",
  "author": "zxxtlz",
  "releaseDate": "2024-02-02",
  "flags": [
    "fonts",
    "menus",
    "scoreboards",
    "minmode",
    "materials",
    "customization"
  ],
  "tags": [
    "minimal",
    "meme"
  ],
  "repo": "https://github.com/zxxtlz/sigmawolfhud",
  "prerelease": false,
  "resources": [
    "sigma",
    "https://youtu.be/IiettpUeDC4"
  ],
  "social": {
    "issues": "https://github.com/zxxtlz/sigmawolfhud/issues",
    "steam_profile": "76561198072827293",
    "youtube": "@zxxtlz",
    "album": "https://imgur.com/a/K6bAsUA"
  },
  "traits": {
    "os": [
      "windows"
    ],
    "gamemode": [
      "tournament",
      "comp",
      "arena",
      "ad",
      "ctf",
      "cp",
      "halloween",
      "koth",
      "mannpower",
      "mvm",
      "pass",
      "pl",
      "plr",
      "pd",
      "rd",
      "sd",
      "tc"
    ],
    "res": [
      "1/1",
      "4/3",
      "5/4",
      "16/10",
      "16/9"
    ],
    "position": [
      "center"
    ],
    "lang": [
      "en"
    ]
  },
  "channels": {
    "default": {
      "data": {
        "ref": "c11bc5870f8781fd66c248c6ef99ad9b5d9df6ea"
      }
    }
  }
}
