{
  "name": "DeniHud",
  "author": "Fraklin",
  "social": {
    "album": "https://imgur.com/a/QBV9HMW"
  },
  "repo": "https://github.com/deni294/DeniHud",
  "resources": [
    "denihud-banner"
  ],
  "channels": {
    "default": {
      "data": {
        "ref": "7cc059987273924da1d7000187861713564176d2"
      }
    }
  }
}
