{
  "name": "GalaHUD",
  "author": "GrenS",
  "social": {
    "album": "https://imgur.com/a/WJGTcvI"
  },
  "repo": "https://gamebanana.com/mods/26481",
  "resources": [
    "galahud-banner"
  ],
  "channels": {
    "default": {
      "data": {
        "ref": "1.1",
        "publishDate": "2019-12-03"
      }
    }
  }
}
