{
  "name": "m0re Quake",
  "author": "Grape",
  "contributors": [
    "Hypnotize"
  ],
  "social": {
    "album": "https://github.com/TF2HUDsArchive/m0re-Quake/blob/screenshots/showcase.md"
  },
  "repo": "https://github.com/TF2HUDsArchive/m0re-Quake",
  "githubAuthor": null,
  "parent": "m0rehud",
  "resources": [
    "m0re-quake-banner"
  ],
  "channels": {
    "default": {
      "data": {
        "ref": "1aca46dd44a367d6abe0f164b35a4c92803c19ea"
      }
    }
  },
  "distinguishedFromParent": false
}
