{
  "name": "malhud",
  "author": "malgreen",
  "social": {
    "steam_group": "malhud",
    "album": "https://imgur.com/a/w4NB521"
  },
  "repo": "https://steamcommunity.com/groups/malhud",
  "resources": [
    "malhud-banner"
  ],
  "channels": {
    "default": {
      "data": {
        "ref": "1.6",
        "publishDate": "2020-11-06"
      }
    }
  }
}
