{
  "name": "KN Old",
  "author": "Chippy",
  "contributors": [
    "Hypnotize"
  ],
  "social": {
    "steam_group": "knhud",
    "album": "https://github.com/TF2HUDsArchive/KN-Hud-Old/blob/screenshots/showcase.md"
  },
  "repo": "https://github.com/TF2HUDsArchive/KN-Hud-Old",
  "githubAuthor": null,
  "parent": "kn-hud",
  "resources": [
    "kn-old-banner"
  ],
  "channels": {
    "default": {
      "data": {
        "ref": "b4c318bcdf02c06c9fed4820283bf8c667d85fb4"
      }
    }
  },
  "distinguishedFromParent": false
}
