{
  "name": "Bast HUD",
  "author": "b4stian",
  "contributors": [
    "Hypnotize"
  ],
  "social": {
    "steam_group": "bastHUD",
    "album": "https://github.com/TF2HUDsArchive/Bast-Hud/blob/screenshots/showcase.md"
  },
  "repo": "https://github.com/TF2HUDsArchive/Bast-Hud",
  "githubAuthor": null,
  "resources": [
    "bast-hud-banner"
  ],
  "channels": {
    "default": {
      "data": {
        "ref": "27ca9594f0bf702a4a474895b66007720fc04b71"
      }
    }
  }
}
