{
  "name": "rayshud",
  "author": "raysfire",
  "contributors": [
    "CriticalFlaw"
  ],
  "social": {
    "steam_group": "rayshud",
    "discord": "/hTdtK9vBhE",
    "album": "https://imgur.com/a/vsxPG"
  },
  "flags": [
    "menus",
    "scoreboards",
    "crosshairs",
    "minmode",
    "materials",
    "customization"
  ],
  "traits": {
    "os": [
      "windows",
      "mac",
      "linux"
    ],
    "gamemode": [
      "tournament",
      "comp",
      "arena",
      "ad",
      "ctf",
      "cp",
      "halloween",
      "koth",
      "mannpower",
      "mvm",
      "pass",
      "pl",
      "plr",
      "pd",
      "rd",
      "sd",
      "tc"
    ],
    "res": [
      "1/1",
      "4/3",
      "5/4",
      "16/10",
      "16/9",
      "17/9",
      "21/9",
      "32/9"
    ],
    "position": [
      "center"
    ],
    "lang": [
      "en"
    ]
  },
  "tags": [
    "minimal"
  ],
  "repo": "https://github.com/raysfire/rayshud",
  "verified": true,
  "resources": [
    "banner",
    "menu",
    "loadout",
    "hud",
    "hud-minmode",
    "scoreboard"
  ],
  "channels": {
    "default": {
      "data": {
        "ref": "a22ede014e4f3b1260aa8fd657ff0757d9d006b8"
      }
    }
  }
}
