{
  "name": "CB HUD",
  "author": "ColdBalls",
  "contributors": [
    "Hypnotize"
  ],
  "social": {
    "album": "https://github.com/TF2HUDsArchive/CB-Hud/blob/screenshots/showcase.md"
  },
  "repo": "https://github.com/TF2HUDsArchive/CB-Hud",
  "githubAuthor": null,
  "resources": [
    "cb-hud-banner"
  ],
  "channels": {
    "default": {
      "data": {
        "ref": "f9ca3c6ad87bb12ffa60bf42c9fa2094df22cb1e"
      }
    }
  }
}
