{
  "name": "Rev HUD",
  "author": "Revilo",
  "contributors": [
    "Hypnotize",
    "tunikun"
  ],
  "social": {
    "album": "https://github.com/TF2HUDsArchive/Rev-Hud/blob/screenshots/showcase.md"
  },
  "flags": [
    "fonts",
    "menus",
    "scoreboards",
    "materials",
    "customization"
  ],
  "traits": {
    "os": [
      "windows"
    ],
    "gamemode": [
      "tournament",
      "comp",
      "arena",
      "ad",
      "ctf",
      "cp",
      "halloween",
      "koth",
      "mannpower",
      "mvm",
      "pass",
      "pl",
      "plr",
      "pd",
      "rd",
      "sd",
      "tc"
    ],
    "res": [
      "16/9"
    ]
  },
  "repo": "https://github.com/TF2HUDsArchive/Rev-Hud",
  "githubAuthor": null,
  "resources": [
    "rev-hud-banner"
  ],
  "channels": {
    "default": {
      "data": {
        "ref": "e642877bbdbaa297991133ce1109356685b6c761"
      }
    }
  }
}
