{
  "name": "deliHUD Neue",
  "author": "deli",
  "social": {
    "steam_group": "deliHUD",
    "album": "https://imgur.com/a/ix8g52d"
  },
  "flags": [
    "fonts",
    "scoreboards",
    "crosshairs",
    "materials",
    "customization"
  ],
  "traits": {
    "os": [
      "windows",
      "linux"
    ],
    "gamemode": [
      "tournament",
      "comp",
      "arena",
      "ad",
      "ctf",
      "cp",
      "halloween",
      "koth",
      "mannpower",
      "mvm",
      "pass",
      "pl",
      "plr",
      "pd",
      "rd",
      "sd",
      "tc"
    ],
    "res": [
      "5/4",
      "16/9",
      "16/10"
    ]
  },
  "repo": "https://github.com/delegacz/deliHUDNeue",
  "parent": "deli-hud",
  "distinguishedFromParent": true,
  "resources": [
    "delihud-neue-banner"
  ],
  "channels": {
    "default": {
      "data": {
        "ref": "97add5b762bf81191d7e07cb45c4172dc169866b"
      }
    }
  }
}
